Questions, Answers
what are the symptoms of brown leaf rot?,"Greetings! Hope you're having a wonderful day! Inna pidicho utharam  symptoms of the disease appear on the leaves, On the leaves, the disease appears as Small brown coloured necrotic spots surrounded by yellow halo
The damaged leaves do not become distorted in shape as occurs with leaves damaged by cassava mosaic disease.
In severe cases abnormal leaf fall occurs"
what are the measure of control of cassava mosaic disease in tapioca?,"Greetings! Hope you're having a wonderful day! Inna pidicho utharam Effective management of Cassava Mosaic Disease (CMD) includes using virus-free planting material and resistant varieties, controlling whitefly vectors with judicious insecticide use, removing infected plants promptly, rotating crops, maintaining soil fertility, monitoring for early symptoms, and exploring biocontrol options for sustainable management."
what are the symptoms of Cassava mosaic disease?,"Greetings! Hope you're having a wonderful day! Inna pidicho utharam White or pale-yellow or pale-green patches on infected leaves.
Leaves often twisted, distorted, and stunted.
The leaflets have localized mosaic pattern.
Heavily infected plant is distorted, retarded, and dwarfed.
Whitefly (Bemisia tabaci) is the carrier of the virus and transmission is through their feeding habits"
what are some of the diseases in tapioca ?,"Greetings! Hope you're having a wonderful day! Inna pidicho utharam some of the diseases are:Cassava mosaic disease,Brown leaf spot,Cassava tuber Rot Disease etc
"
what are the measures of control of mouldy root?,"Greetings! Hope you're having a wonderful day! Inna pidicho utharam fungicides are metalaxyl-M,phosphorous acis etc."
what are the diseases in turmeric?,"Greetings! Hope you're having a wonderful day! Inna pidicho utharam Certainly! Here are some main diseases affecting turmeric: Rhizome rot ,Foliar disease,Leaf blight etc."
what are the measures to control rhizome rot?, Here are some methods of preventing rhizome rot:Dipping rhizomes in soil and drenching with Ridomil at the first appearance of symptoms controls it and increases yield.
what are the symptoms of rhizome rot?," Certainly ! here are some symptoms : Isolated plants may involve several adjacent clumps resulting in diseased patches , leaves show gradual drying up of leaves along margins and covers the entire leaf.The root system is adversely affected and decays."
what are the symptoms of foliar disease?, Here are some symptoms of Foliar disease:The collar region of the affected pseudostem becomes water soaked and the rotting spreads to the rhizome resulting in soft rot.  It causes light yellowing of the tips of lower leaves which gradually spreads to the leaf blades.Hope this cleared your concerns.
what are the measures to control foliar disease?," You can improve water management by irrigating in the morning so plants may dry completely. Pruning can allow for better air circulation, while removing dead, infected twigs that may serve as a source of infection in the spring."
what are the symptoms of leaf blight?," Here are some symptoms of Leaf Blight: The disease manifests as water soaked spots of varying shapes and sizes on the
lower leaves which gradually increase
in size during warm and humid weather
resulting in bligtening of entire leaf
area. The blighted leaf area is divided
or banded into various sectors which are
characteristic symptoms for early diag'
nosis."
what are the fungicides to prevent Leaf Blight?," Certainly here are some fungicides to control leaf blight:Mancozeb,Chlorothalonil,carbendazim etc."
what are the fungicides to prevent foliar disease?," Here are some fungicides for foliar disease: Copper Oxychloride,Mancozeb,chllrothalonil etc"
what are some of the diseases in cashew plants ?," Here are some of the diseases in cashew plants: Pink disease,Anthracnose,Inflorescence blight,shoot rot and leaf fall "
what are the symptoms of pink disease?," Certainly here are some symptoms of Pink Disease:Whitish or pinkish growth of the fungus can be seen on the affected branches.
The fungus penetrates into the deeper tissues and causes the death of the shoots from the tip downwards and hence the name dieback.
After heavy rains a film of silky thread of the fungus is seen on the branches.
In advanced stages, the bark splits and peels off. Some times only one branch is affected, but often many branches turn yellow and shed giving a barren appearance to a portion of the tree."
what are the prevention and control measures of pink disease?," Here are some methods:Prune the affected branches well below the site of infection and destroy them.
Protect the cut surfaces by applying Bordeaux paste.
If disease is severe, it is advisable to spray Bordeaux mixture (I %).
Spraying is to be done twice, once in. May-June and the second during October.
Collect all dried up and affected branches to reduce the source of inoculum."
what is the cause of anthracnose and what are the solutions?,"Greetings! Hope you're having a wonderful day! Inna pidicho utharam Fungus is the main cause for the disease.As anthracnose is primarily a disease that occurs during the rainy season, systemic fungicides are required to prevent chemicals leaching from the plant; 1% Bordeaux mixture can be applied during monsoon season; metalaxyl and fosetyl are also effective"
what are the symptoms of Inflorescence Blight?," Absolutely!Here are some symptoms :The characteristic symptom is the drying of floral branches. The symptoms appear as minute water soaked lesions on the main rachis and secondary rachis.
The lesions are pinkish brown, enlarge and soon turn scabby. Gummy exudates can be seen at the affected regions.
The lesions develop into bigger patches and result in drying up of the inflorescences. The incidence is very severe when cloudy weather prevails."
what are the prevention and control measures of Inflorescence Blight ?," Here are some measures :A combination spray of a fungicide (Cuman L 100 ml in 100 litres of water or Blitox 250 g) and an insecticide Dimecron (30 ml in 100 litres) is recommended.
"
what are the symptoms of shoot rot and leaf fall?," Absolutely! the symptoms are: Black elongate lesions are first developed on the stem with exudation of gum. Later, infection spreads up and down, causing the tender stem to collapse and tender leaves to shrivel up.
The lower mature leaves are also infected with black elongated lesions on mid rib, which later spread to the main lateral veins and the leaf blade.
The infected leaves are soon shed."
what are the prevention and control measures of shoot rot and leaf fall ?,Greetings! Hope you're having a wonderful day! Inna pidicho utharam Spraying with Bordeaux mixture (l %) before the onset of monsoon will check the spread of the disease.Hope the answer is  to your satisfaction.
what are some of the diseases in rubber tree?," Here are some diseases of rubber tree:Birds eye spot,Black stripes,mouldy rot,white root disease etc"
what are some of the symptoms of bird's eye spot?,Greetings! Hope you're having a wonderful day! Inna pidicho utharam Some of the symptoms are:leaf defoliation and young leves covered with powdery mildew
what are the control measures of birds eye  spot?, Greetings here are some measures: sulphur dusting and field sanitization
what are the symptoms of pink disease?,"Greetings! Hope you're having a wonderful day! Inna pidicho utharam Pink color growth on the bark surface with streaks on latex oozing out from the lesions,infection usually in the fork region etc"
what are the symptoms of Black stripes?,"Greetings! Hope you're having a wonderful day! Inna pidicho utharam Small depression formed due to localized rotting,during of bark gets pressed to the wood,reduces yield etc"
what are the measures to control black stripes in rubber?,"Greetings! Hope you're having a wonderful day! Inna pidicho utharam copper based fungicides  like metalaxyl,mancozeb etc can be sprayed."
what are the symptoms of white root disease in rubber?,"Greetings! Hope you're having a wonderful day! Inna pidicho utharam foliage discoloration,tree branch die back,tree death etc"
what are the measures to control white root disease in rubber?,"Greetings! Hope you're having a wonderful day! Inna pidicho utharam chemical control includes fungicides like hexaconazole,tridemorph etc.Mechanical control includes root barriers .Integrated pest management can also be used."
what are the symptoms of mouldy root in rubber?,"Greetings! Hope you're having a wonderful day! Inna pidicho utharam root discoloration,root rot,reduced root mass,stunted growth etc"
, 
